Name in Sources,Transliterated Name,Arabic Name,Start-Month,Start-Day,Start-Year,End-Month,End-Day,End-Year,Tenure (Years),Fate,Ethnicity,Prior Leadership Experience,Type of Experience,HistoricName_City_Origin,ModernName_City_Origin,ModernName_Country_Origin,Algerian Wife/Wives,Algerian family,Citations,Notes,Additional notes,Additional Notes
"Ahmed Chaouche, known as El-Kebayli         ",Ahmed Shāūsh Al-Qebāīlī,أحمد شاوش القبايلي,09,,1808,09,,1808,0.04109589041,Assassinated,Ottoman,1,Chaouche,unknown,unknown,unknown,unknown,unknown,"Vayssettes, 178-185; Mercier, 329-334; Gaid, 62-65; Al-Antari, 77-78.","""un Turc, nommé Ahmed-Chaouch"" (Mercier, 329). Governed for 15 days.","""Quelques turcs mariés, et qui avaient leur famille à Constantine, vinrent lui représenter la consternation qui régnait partout."" (Vayssettes, 2005). This suggests that it was relatively common for Ottoman administrators to marry into local families in Constantine.",15 days in Sept 1808 
Ahmed Tobbal        ,Ahmed Tubāl Bāy, أحمد طوبال باي,,,1808,,,1811,3,Assassinated,Ottoman,1,Khalifa,unknown,unknown,unknown,unknown,unknown,"Vayssettes, 185-186; Mercier, 334-337; Gaid, 65-66; Al-Antari, 79.","""Ahmed-Tobbal, Turc de naissance, habitait depuis longtemps Constantine, lorsqu'il fut appelé par la confiance du pacha au gouvernement de la province."" (Vayssettes, 185)","Spent a great part of his career in Constantine, where he established himself after his retirement [before his elevation to Bey]. (Gaid, 65). ""Ahmed el-Tobbal continued to administer the province with great wisdom; and he had already reigned for two and a half years, when Algiers was ordered to put him to death. He had furnished the Jew David Bacri some time before with three loads of corn. The successor of Ali-Khodja, Hadj-Ali, one of the most shady and bloodthirsty deys that the regency has had, after having beheaded this same Bacri, sentenced all those who had had relationships with this Jew. Ahmed el-Tobbal, in spite of his services, could not escape this unjust condemnation. He was strangled and his successor was Naaman Bey."" (Vayssettes, 2005)","""bach-tobbal"" = chief of the drums and war music. Did Ahmed previously hold this position, thereby earning the nickname, ""Tobbal""? (Mercier, 214; al-Antari, 79)"
Mohammed Naman bey Ben-Ali  ,Muḥammed Nʿmān Bāy Ben ʿlī,محمد نعمان باي بن علي,,,1811,,,1814,3,Assassinated,Ottoman,1,Khalifa,unknown,unknown,unknown,1,"Married the sister of Maggoura Ben Bou-Rennane, one of the tribes of the Medjana, which was under the control of the Mokrani (Mercier, 337)","Vayssettes, 187-190; Mercier, 337-340; Gaïd, 66; Al-Antari, 80.","""Turc de naissance"" (Gaïd, 66). Former Khalifa of Abd-Allah Bey and son-in-law of Zereg-Ainou (Vayssettes, 187).","One remembers that in one of the previous campaigns against Tunis, Naaman had to give the command of the troops to Omar-Agha, aghah of Algiers. From there arose between these two characters a rivalry which soon degenerated into open hostilities.  A[nother] Turk, a native of Smyrna and a long-time resident of Constantine, took advantage of the dispositions of the two chiefs and succeeded, by denouncing Naaman Bey, to captivate the good graces of the Agha, so that he promised him to not neglect anything with the Pasha to have him named Bey in place of his rival. But Naaman administered the province with great distinction, and it was hardly to be supposed that the dey consented to dispossess him, without serious motives.  (Vayssettes, 2005).",
Mohammed Tchakar bey         ,Muḥammed Shākr Bāy,محمد شاكر باي,,,1814,,,1818,4,Assassinated,Ottoman,1,Janissary officer,Smyrna,Izmir,Turkey,1,Ben Gana,"Vayssettes, 190-205; Mercier, 340-349; Gaid, 69-75; Al-Antari, 81-4.","""Un officier turc, originaire de Smyrne"" (Mercier, 340). He was the protégé (client) of Omar-Agha ['s patronage], the Dey of Algiers, who elevated him to the position of Bey. (Gaid, 68-9). He served in the Janissary corps and was then named Caid of the Ameur-Cheraga and then reintegrated into the military by Naaman-Bey.","Note sent ahead of the Mohammed's arrival in Constantine: ""At the receipt of my orders, you will have your secretary, Si Ahmed ben es-Saïeh, and his brother Tayeb, Caid-Azib-el-Begueur, their sister Aïcha and all their kin arrested, as being former servants of the bey."" (Vayssettes, 2005). It's interesting that he specifically mentions Aisha, the sister of the named men, who should also be rounded up.  Who was Aisha to be so named and even re-recorded in this French chronicle?","Married one of Hadj Ahmed Bey's aunts (in the Ben Gana tribe, presumably). (Geneviéve, 283)"
Kara Mustapha        ,Qāra Muṣṭafa Bāy, قارة مصطفى باي,,,1818,,,1818,0.08333333333,Assassinated,Ottoman,1,Chaouche,unknown,unknown,unknown,unknown,unknown,"Vayssettes, 205-207; Mercier, 349-351; Gaid, 75-76; Al-Antari, 85.","""Kara-Mostefa était Turc d'origine."" (Gaid, 75)  In response to Kara Mustapha's abuse of power and misrule, ""Le pacha Ali-Khodja prononca aussitot sa destitution et, dans un momnet d'humeur contre les Turcs, il nomma à sa place un mamelouk, d'origine italienne, de nom d'Ahmed, ajoutant que, si celui-ci ne faisait pas l'affaire des Constantinois, il leur donnerait un negre du Soudan pour bey."" (Vayssettes, 207).  Governed for 33 days",,
Ahmed Bey El Mamelouk Ben Abd-Allah        ,Ahmed Bāy Ben ʿbd Allah Al Mamlūk, أحمد باي بن عبد الله المملوك,01,,1818,07,,1818,0.5,Reinstated,European,1,Bey,unknown,unknown,Italy,unknown,unknown,"Vayssettes, 207-208; Mercier, 351-353; Gaid, 76-78; Al-Antari, 85.","""Le dey avait nommé au beylick de Constantine, un rénégat d'origine italienne, nommé Ahmed-Bey, le Mamlouk"" (Mercier, 351). Governed for only about 6 months and was reinstated later, only to be exiled and assassinated. Made Hadj Ahmed Bey Ben Mohmmed Cherif his Khalifa.","Ahmed Bey's name makes it very clear that he was a European or Causcasian manumitted slave with the name ""El Mamluk"" and ""ibn Abdallah""",Jan 1818 - July 1818
Mohammed bey El-Mili Ben Daoud,Muḥammed Bāy Ben Dāūd Al-Mīlī Bu Shaṭābī,محمد باي بن داود الميلي بوشطابي,,,1818,,,1819,1,Exiled,Ottoman,1,Caid al-Awasi,unknown,unknown,unknown,unknown,unknown,"Vayssettes, 208-210; Mercier, 353-355; Gaid, 78-79; Al-Antari, 86.","He had just been named Caid al-Awasi and had not yet joined his post when he was promoted to the provincial command (Vayssettes, 208). Exiled to Algiers. He named Hadj Ahmed Ben Mohamed Cherif as his Khalifa. (Gaid, 78)"," He also had the nickname of Bou Chetabia because he had invented an ax with a broad and sharp edge to serve as an instrument for the executioner. (Gaid, 78)",
Ibraham Bey El-Gharbi       ,Ibrāhīm Khūdja Bāy Al-Gharbī, إبراهيم خوجة باي الغربي ,06,,1819,07,,1820,1,Assassinated,Ottoman,1,Bey,unknown,unknown,unknown,unknown,unknown,"Vayssettes, 210-211; Mercier, 355-358; Gaid, 79-80; Al-Antari, 86-7; Temimi, 49; CAOM 15 MI 14, vol. 13, p. 64.","""était bey de Médéa quand il fut désigné a la tet du beylec de l'Est."" (Gaid, 79). He maintained Hadj Ahmed Ben Mohamed Cherif as his Khalifa (Gaid, 79). ""Les chaouchs lui passèrent le lacet autour du cou selon la coutume réservée aux Turcs."" (Gaid, 80) This also suggests that he was Ottoman.","He maintained Hadj Ahmed as his Khalifa, not only to attached to himself some of the great autochthonous families to which he [Hadj Ahmed] was connected, but also the numerous Kulughlus from Constantine and elsewhere who were established in the province. (Gaid, 79) This suggests that he was Ottoman. He was the bey of Medea and found himself in Algiers at the same time as Bou Chetabia [who was exiled] and it was this circumstance that led to his nomination (Vayssettes, 210). When Ahmed Bey Mameluk replaced Ibrahim, Ahmed seized his predessor and killed him (Temimi, 49).",June 1819 - July 1820
Ahmed Bey El Mamelouk Ben Abd-Allah        ,Ahmed Bāy Ben ʿbd Allah Al Mamlūk, أحمد باي بن عبد الله المملوك,,,1820,,,1822,2,Exiled and Assassinated,European,1,Bey,unknown,unknown,Italy,unknown,unknown,"Vayssettes, 212-218; Mercier, 358-363; Gaid, 80-82; Al-Antari, 87-88.","""Le dey avait nommé au beylick de Constantine, un rénégat d'origine italienne, nommé Ahmed-Bey, le Mamlouk"" (Mercier, 351). ",,
Ibrahim Bey Ben Ali El-Critli ,Ibrāhīm  Bāy Ali Al-Qritlī,إبراهيم باي القرتلي,,,1822,,,1824,2,Exiled and Assassinated,Ottoman,1,Caid al-Awasi,unknown,unknown,"Crete, Greece",1,unknown,"Vayssettes, 218-223; Mercier, 363-367; Gaid, 83-88; Al-Antari, 88-9.","""C'etait, en effet, un des anciens de la villet, et, quoique d'origine turc, les bonnes relations qu'il avait toujours entretenues avec les oulemas et le reste de la poppulation, lui avaient gange depuis longtemps la sympathie de tous"" (Vayssettes, 219). Exiled to Medea and assassinated in 1832 on Ahmed Bey's orders","He was Caid of the Haractas when he was named to the post of Bey (Gaid, 83). Temimi refers to him as ""le crétois,"" the Cretan, citing CAOM 15 Mi. 14, Vo. 13, p. 63.",
Mohammed Manamli         ,Muḥammed Bāy Ben Khān, محمد باي بن خان,,,1824,,,1826,2,Exiled,Ottoman,1,Janissary,unknown,Menemen,Turkey,unknown,unknown,"Vayssettes, 223-227; Mercier, 367-370; Gaïd, 88; Al-Antari, 89.","""originaire de Menamen (Turquie) janissaire"" (Gaïd, 88) .""Turc de nassaince"" (Vayssettes, 223). or Manamani; exiled to Algiers. ",,
Ahmed Bey         ,Ahmed Bāy Ben Muḥammed Al-Sharīf,أحمد باي بن محمد الشريف,,,1826,,,1837,11,Dethroned by French,Kulughlu,1,Caid al-Awasi,unknown,Constantine,Algeria,7,Multiple: Bou Mezrag (Tittery); Muqrani; Ben-Gana; Beni-al-Khudja,"Vayssettes, 228-245; Mercier, 371-441; Gaid, 89-96; Al-Antari, 90-94; Boyer, ""Le Problème Kouloughli dans la Régence d'Alger;"" Temimi, 49","""c'est un Kouloughli, violemment anti-turc"" (Pierre Boyer). ""En 1826, le Dey Husseign désigna le Kuloglu Hadj Ahmed comme Bey, celui-ci ""connaissait bien les moeurs, la langue et le pays que son (grand) père avait gouverné avec équité."" (Temimi, 49, citing `Ali Rida Pasha, Mirat-ul-Djazair, le miroir de l'Algérie, p. 97 [Istanbul, 1876])",,